{
  "$schema": "https://json-schema.org/draft/2020-12/schema",
  "type": "object",
  "properties": {
    "customer_admin_graphql_api_id": {
      "type": "string",
      "format": "uri"
    },
    "title": {
      "type": "string"
    },
    "locale": {
      "type": "string"
    },
    "created_at": {
      "type": "string",
      "format": "date-time"
    },
    "updated_at": {
      "type": "string",
      "format": "date-time"
    },
    "admin_graphql_api_id": {
      "type": "string",
      "format": "uri"
    },
    "company": {
      "type": "object",
      "properties": {
        "name": {
          "type": "string"
        },
        "note": {
          "type": "string"
        },
        "external_id": {
          "type": "string"
        },
        "main_contact_admin_graphql_api_id": {
          "type": "string",
          "format": "uri"
        },
        "created_at": {
          "type": "string",
          "format": "date-time"
        },
        "updated_at": {
          "type": "string",
          "format": "date-time"
        },
        "customer_since": {
          "type": "string",
          "format": "date-time"
        },
        "admin_graphql_api_id": {
          "type": "string",
          "format": "uri"
        }
      },
      "required": [
        "name",
        "note",
        "external_id",
        "main_contact_admin_graphql_api_id",
        "created_at",
        "updated_at",
        "customer_since",
        "admin_graphql_api_id"
      ]
    }
  },
  "required": [
    "customer_admin_graphql_api_id",
    "title",
    "locale",
    "created_at",
    "updated_at",
    "admin_graphql_api_id",
    "company"
  ]
}